{
  "schema_version": "1.0",
  "task_dir": ".tasks/task-example-feature",
  "openspec_change": "openspec/changes/example-feature",
  "call_id": "2026-04-16T12-00-00Z-p3-analytic",
  "target_subagent": "1c-analytic",
  "phase": 3,
  "feature_slug": "example-feature",
  "complexity": "средняя",
  "focus": "OpenSpec proposal по доработке проведения документа",
  "gate_documents": {
    "proposal": {
      "path": "openspec/changes/example-feature/proposal.md",
      "source_revision": 0
    },
    "design": {
      "path": "openspec/changes/example-feature/design.md",
      "source_revision": 0
    },
    "tasks": {
      "path": "openspec/changes/example-feature/tasks.md",
      "source_revision": 0
    }
  },
  "spec_deltas": [
    "openspec/changes/example-feature/specs/example-domain/spec.md"
  ],
  "slices": {
    "phase0_summary": "Средняя сложность: затронуты документ, регистр, форма.",
    "phase1_summary": "Пользователь: автозаполнение табличной части по шаблону; ограничения по правам.",
    "discovery_summary": {
      "hypotheses": [
        "Логика в модуле менеджера документа X",
        "Подписка на событие Y"
      ],
      "confirmed_chains": [
        "Команда формы → сервер → запись регистра Z"
      ],
      "modification_points": [
        "Documents/X/Ext/ObjectModule.bsl — процедура Проведение"
      ]
    },
    "req_items": []
  },
  "anchors": [
    {
      "path": "src/cf/Documents/ПримерДокумента/Ext/ObjectModule.bsl",
      "line_start": 120,
      "line_end": 180,
      "label": "Проведение"
    }
  ],
  "read_paths": [
    ".tasks/task-example-feature/phase1-requirements.md",
    ".tasks/task-example-feature/phase0-complexity.md",
    ".tasks/task-example-feature/discovery.md"
  ],
  "write_hint": "Заполнить OpenSpec proposal.md и delta specs; не создавать .tasks/prd.md"
}
